"postId","title","description","location","salary","experience","typeOfWork","companyId","companyName","cityName","industryNames"
"8bacdf64-12f2-11f0-8a60-0a0027000011","Luật sư tư vấn du lịch","Tư vấn pháp lý công ty du lịch. Soạn thảo hợp đồng tour. Giải quyết tranh chấp khách hàng. Hỗ trợ tuân thủ quy định. Theo dõi luật mới.","E17A KP5, Phường Tân Hiệp, Thành phố Biên Hòa, Tỉnh Đồng Nai","32000000","3 năm","Toàn thời gian","","CÔNG TY LUẬT TNHH LUẬT VIỆT GLOBAL","Đồng Nai","Kinh doanh | Luật | Marketing/Truyền thông | Thiết kế/In ấn"
"8bace07c-12f2-11f0-8a60-0a0027000011","Chuyên viên pháp lý thương mại điện tử","Hỗ trợ pháp lý kinh doanh online. Kiểm tra hợp đồng giao dịch. Tư vấn quy định thương mại điện tử. Giải quyết tranh chấp trực tuyến. Báo cáo rủi ro.","E17A KP5, Phường Tân Hiệp, Thành phố Biên Hòa, Tỉnh Đồng Nai","25000000","2 năm","Toàn thời gian","","CÔNG TY LUẬT TNHH LUẬT VIỆT GLOBAL","Đồng Nai","Kinh doanh | Luật | Marketing/Truyền thông | Thiết kế/In ấn"
"8bace1ab-12f2-11f0-8a60-0a0027000011","Nhân viên pháp lý giáo dục","Hỗ trợ pháp lý trường học. Kiểm tra hợp đồng giáo dục. Tư vấn quy định giáo dục. Chuẩn bị tài liệu pháp lý. Liên hệ cơ quan.","E17A KP5, Phường Tân Hiệp, Thành phố Biên Hòa, Tỉnh Đồng Nai","15000000","1 năm","Toàn thời gian","","CÔNG TY LUẬT TNHH LUẬT VIỆT GLOBAL","Đồng Nai","Kinh doanh | Luật | Marketing/Truyền thông | Thiết kế/In ấn"
"8bace2d0-12f2-11f0-8a60-0a0027000011","Luật sư tư vấn bảo hiểm","Tư vấn pháp lý hợp đồng bảo hiểm. Soạn thảo điều khoản bảo hiểm. Giải quyết tranh chấp bảo hiểm. Hỗ trợ tuân thủ quy định. Theo dõi luật mới.","E17A KP5, Phường Tân Hiệp, Thành phố Biên Hòa, Tỉnh Đồng Nai","33000000","3 năm","Toàn thời gian","","CÔNG TY LUẬT TNHH LUẬT VIỆT GLOBAL","Đồng Nai","Kinh doanh | Luật | Marketing/Truyền thông | Thiết kế/In ấn"
"8bace3f6-12f2-11f0-8a60-0a0027000011","Chuyên viên pháp lý bất động sản","Hỗ trợ pháp lý dự án bất động sản. Kiểm tra hợp đồng mua bán. Tư vấn quy định đất đai. Giải quyết tranh chấp tài sản. Báo cáo rủi ro.","E17A KP5, Phường Tân Hiệp, Thành phố Biên Hòa, Tỉnh Đồng Nai","24000000","2 năm","Toàn thời gian","","CÔNG TY LUẬT TNHH LUẬT VIỆT GLOBAL","Đồng Nai","Kinh doanh | Luật | Marketing/Truyền thông | Thiết kế/In ấn"
"8bace50e-12f2-11f0-8a60-0a0027000011","Nhân viên hỗ trợ pháp lý lao động","Hỗ trợ pháp lý quan hệ lao động. Chuẩn bị hồ sơ lao động. Tư vấn quy định lao động. Liên hệ cơ quan chức năng. Quản lý tài liệu.","E17A KP5, Phường Tân Hiệp, Thành phố Biên Hòa, Tỉnh Đồng Nai","16000000","1 năm","Toàn thời gian","","CÔNG TY LUẬT TNHH LUẬT VIỆT GLOBAL","Đồng Nai","Kinh doanh | Luật | Marketing/Truyền thông | Thiết kế/In ấn"
"8bace661-12f2-11f0-8a60-0a0027000011","Luật sư tư vấn môi trường","Tư vấn pháp lý dự án môi trường. Soạn thảo báo cáo tác động. Giải quyết tranh chấp môi trường. Hỗ trợ xin giấy phép. Theo dõi chính sách.","P802 #8 Tòa nhà Viet Nam Business Center 57-59 Hồ Tùng Mậu, Phường Bến Nghé, Quận 1, Thành phố Hồ Chí Minh","34000000","3 năm","Toàn thời gian","","CÔNG TY LUẬT TNHH MỘT THÀNH VIÊN NAM SƠN","Thành phố Hồ Chí Minh","Luật"
"8baf90cf-12f2-11f0-8a60-0a0027000011","Chuyên viên pháp lý tài chính","Hỗ trợ pháp lý khoản vay. Kiểm tra hợp đồng tài chính. Tư vấn quy định ngân hàng. Giải quyết tranh chấp nợ. Báo cáo rủi ro.","P802 #8 Tòa nhà Viet Nam Business Center 57-59 Hồ Tùng Mậu, Phường Bến Nghé, Quận 1, Thành phố Hồ Chí Minh","25000000","2 năm","Toàn thời gian","","CÔNG TY LUẬT TNHH MỘT THÀNH VIÊN NAM SƠN","Thành phố Hồ Chí Minh","Luật"
"8baf92d7-12f2-11f0-8a60-0a0027000011","Nhân viên pháp lý xây dựng","Hỗ trợ pháp lý dự án xây dựng. Kiểm tra giấy phép xây dựng. Tư vấn quy định xây dựng. Chuẩn bị tài liệu pháp lý. Liên hệ cơ quan.","P802 #8 Tòa nhà Viet Nam Business Center 57-59 Hồ Tùng Mậu, Phường Bến Nghé, Quận 1, Thành phố Hồ Chí Minh","17000000","1 năm","Toàn thời gian","","CÔNG TY LUẬT TNHH MỘT THÀNH VIÊN NAM SƠN","Thành phố Hồ Chí Minh","Luật"
"8baf944e-12f2-11f0-8a60-0a0027000011","Luật sư tư vấn năng lượng tái tạo","Tư vấn pháp lý dự án năng lượng tái tạo. Soạn thảo hợp đồng cung cấp. Giải quyết tranh chấp năng lượng. Hỗ trợ xin giấy phép. Theo dõi chính sách.","P802 #8 Tòa nhà Viet Nam Business Center 57-59 Hồ Tùng Mậu, Phường Bến Nghé, Quận 1, Thành phố Hồ Chí Minh","35000000","3 năm","Toàn thời gian","","CÔNG TY LUẬT TNHH MỘT THÀNH VIÊN NAM SƠN","Thành phố Hồ Chí Minh","Luật"
"8baf9586-12f2-11f0-8a60-0a0027000011","Chuyên viên pháp lý y tế","Hỗ trợ pháp lý bệnh viện. Kiểm tra hợp đồng y tế. Tư vấn quy định y tế. Giải quyết tranh chấp y tế. Báo cáo rủi ro.","P802 #8 Tòa nhà Viet Nam Business Center 57-59 Hồ Tùng Mậu, Phường Bến Nghé, Quận 1, Thành phố Hồ Chí Minh","26000000","2 năm","Toàn thời gian","","CÔNG TY LUẬT TNHH MỘT THÀNH VIÊN NAM SƠN","Thành phố Hồ Chí Minh","Luật"
"8baf96b3-12f2-11f0-8a60-0a0027000011","Nhân viên pháp lý đấu thầu","Hỗ trợ pháp lý đấu thầu. Kiểm tra hồ sơ thầu. Tư vấn quy định đấu thầu. Chuẩn bị tài liệu pháp lý. Liên hệ cơ quan.","P802 #8 Tòa nhà Viet Nam Business Center 57-59 Hồ Tùng Mậu, Phường Bến Nghé, Quận 1, Thành phố Hồ Chí Minh","16000000","1 năm","Toàn thời gian","","CÔNG TY LUẬT TNHH MỘT THÀNH VIÊN NAM SƠN","Thành phố Hồ Chí Minh","Luật"
"8baf9851-12f2-11f0-8a60-0a0027000011","Luật sư tư vấn hàng không","Tư vấn pháp lý vận tải hàng không. Soạn thảo hợp đồng hàng không. Giải quyết tranh chấp vận chuyển. Hỗ trợ tuân thủ quy định. Theo dõi luật mới.","P802 #8 Tòa nhà Viet Nam Business Center 57-59 Hồ Tùng Mậu, Phường Bến Nghé, Quận 1, Thành phố Hồ Chí Minh","37000000","4 năm","Toàn thời gian","","CÔNG TY LUẬT TNHH MỘT THÀNH VIÊN NAM SƠN","Thành phố Hồ Chí Minh","Luật"
"8baf9979-12f2-11f0-8a60-0a0027000011","Chuyên viên pháp lý hợp đồng quốc tế","Hỗ trợ pháp lý hợp đồng quốc tế. Kiểm tra điều khoản song ngữ. Tư vấn quy định thương mại toàn cầu. Giải quyết tranh chấp quốc tế. Báo cáo rủi ro.","P802 #8 Tòa nhà Viet Nam Business Center 57-59 Hồ Tùng Mậu, Phường Bến Nghé, Quận 1, Thành phố Hồ Chí Minh","32000000","3 năm","Toàn thời gian","","CÔNG TY LUẬT TNHH MỘT THÀNH VIÊN NAM SƠN","Thành phố Hồ Chí Minh","Luật"
"8baf9aa5-12f2-11f0-8a60-0a0027000011","Nhân viên pháp lý môi trường","Hỗ trợ pháp lý dự án môi trường. Kiểm tra giấy phép môi trường. Tư vấn quy định bảo vệ môi trường. Chuẩn bị tài liệu pháp lý. Liên hệ cơ quan.","P802 #8 Tòa nhà Viet Nam Business Center 57-59 Hồ Tùng Mậu, Phường Bến Nghé, Quận 1, Thành phố Hồ Chí Minh","17000000","1 năm","Toàn thời gian","","CÔNG TY LUẬT TNHH MỘT THÀNH VIÊN NAM SƠN","Thành phố Hồ Chí Minh","Luật"
"8baf9bc2-12f2-11f0-8a60-0a0027000011","Luật sư tư vấn cổ phần hóa","Tư vấn pháp lý cổ phần hóa. Soạn thảo điều lệ công ty. Giải quyết tranh chấp cổ đông. Hỗ trợ đăng ký chứng khoán. Theo dõi luật mới.","P802 #8 Tòa nhà Viet Nam Business Center 57-59 Hồ Tùng Mậu, Phường Bến Nghé, Quận 1, Thành phố Hồ Chí Minh","38000000","4 năm","Toàn thời gian","","CÔNG TY LUẬT TNHH MỘT THÀNH VIÊN NAM SƠN","Thành phố Hồ Chí Minh","Luật"
"8baf9ce9-12f2-11f0-8a60-0a0027000011","Chuyên viên pháp lý thương hiệu","Hỗ trợ đăng ký thương hiệu. Kiểm tra hợp đồng nhượng quyền. Tư vấn bảo vệ thương hiệu. Giải quyết tranh chấp nhãn hiệu. Báo cáo rủi ro.","P802 #8 Tòa nhà Viet Nam Business Center 57-59 Hồ Tùng Mậu, Phường Bến Nghé, Quận 1, Thành phố Hồ Chí Minh","25000000","2 năm","Toàn thời gian","","CÔNG TY LUẬT TNHH MỘT THÀNH VIÊN NAM SƠN","Thành phố Hồ Chí Minh","Luật"
"8baf9dfe-12f2-11f0-8a60-0a0027000011","Nhân viên pháp lý vận tải","Hỗ trợ pháp lý vận tải đường bộ. Kiểm tra hợp đồng vận chuyển. Tư vấn quy định giao thông. Chuẩn bị tài liệu pháp lý. Liên hệ cơ quan.","P802 #8 Tòa nhà Viet Nam Business Center 57-59 Hồ Tùng Mậu, Phường Bến Nghé, Quận 1, Thành phố Hồ Chí Minh","16000000","1 năm","Toàn thời gian","","CÔNG TY LUẬT TNHH MỘT THÀNH VIÊN NAM SƠN","Thành phố Hồ Chí Minh","Luật"
"8baf9f4b-12f2-11f0-8a60-0a0027000011","Luật sư tư vấn hợp tác quốc tế","Tư vấn pháp lý hợp tác quốc tế. Soạn thảo thỏa thuận song phương. Giải quyết tranh chấp quốc tế. Hỗ trợ đàm phán. Theo dõi luật toàn cầu.","P802 #8 Tòa nhà Viet Nam Business Center 57-59 Hồ Tùng Mậu, Phường Bến Nghé, Quận 1, Thành phố Hồ Chí Minh","39000000","4 năm","Toàn thời gian","","CÔNG TY LUẬT TNHH MỘT THÀNH VIÊN NAM SƠN","Thành phố Hồ Chí Minh","Luật"
"8bafa0cb-12f2-11f0-8a60-0a0027000011","Chuyên viên pháp lý bán lẻ","Hỗ trợ pháp lý kinh doanh bán lẻ. Kiểm tra hợp đồng nhượng quyền. Tư vấn quy định tiêu dùng. Giải quyết tranh chấp bán hàng. Báo cáo rủi ro.","P802 #8 Tòa nhà Viet Nam Business Center 57-59 Hồ Tùng Mậu, Phường Bến Nghé, Quận 1, Thành phố Hồ Chí Minh","26000000","2 năm","Toàn thời gian","","CÔNG TY LUẬT TNHH MỘT THÀNH VIÊN NAM SƠN","Thành phố Hồ Chí Minh","Luật"
"8bafa1f0-12f2-11f0-8a60-0a0027000011","Nhân viên hỗ trợ pháp lý xây dựng","Hỗ trợ kiểm tra giấy phép xây dựng. Chuẩn bị hồ sơ dự án. Tư vấn quy định xây dựng. Liên hệ cơ quan chức năng. Quản lý tài liệu.","P802 #8 Tòa nhà Viet Nam Business Center 57-59 Hồ Tùng Mậu, Phường Bến Nghé, Quận 1, Thành phố Hồ Chí Minh","17000000","1 năm","Toàn thời gian","","CÔNG TY LUẬT TNHH MỘT THÀNH VIÊN NAM SƠN","Thành phố Hồ Chí Minh","Luật"
"8bafa2ff-12f2-11f0-8a60-0a0027000011","Luật sư tư vấn mua bán doanh nghiệp","Tư vấn pháp lý M&A. Soạn thảo hợp đồng mua bán. Giải quyết tranh chấp cổ phần. Hỗ trợ đàm phán. Theo dõi quy định.","P802 #8 Tòa nhà Viet Nam Business Center 57-59 Hồ Tùng Mậu, Phường Bến Nghé, Quận 1, Thành phố Hồ Chí Minh","40000000","4 năm","Toàn thời gian","","CÔNG TY LUẬT TNHH MỘT THÀNH VIÊN NAM SƠN","Thành phố Hồ Chí Minh","Luật"
"8bafa407-12f2-11f0-8a60-0a0027000011","Chuyên viên pháp lý du lịch","Hỗ trợ pháp lý công ty du lịch. Kiểm tra hợp đồng tour. Tư vấn quy định du lịch. Giải quyết tranh chấp khách hàng. Báo cáo rủi ro.","P802 #8 Tòa nhà Viet Nam Business Center 57-59 Hồ Tùng Mậu, Phường Bến Nghé, Quận 1, Thành phố Hồ Chí Minh","25000000","2 năm","Toàn thời gian","","CÔNG TY LUẬT TNHH MỘT THÀNH VIÊN NAM SƠN","Thành phố Hồ Chí Minh","Luật"
"8bafa525-12f2-11f0-8a60-0a0027000011","Nhân viên pháp lý thương mại điện tử","Hỗ trợ pháp lý kinh doanh online. Kiểm tra hợp đồng thương mại. Tư vấn quy định giao dịch. Chuẩn bị tài liệu pháp lý. Liên hệ cơ quan.","P802 #8 Tòa nhà Viet Nam Business Center 57-59 Hồ Tùng Mậu, Phường Bến Nghé, Quận 1, Thành phố Hồ Chí Minh","16000000","1 năm","Toàn thời gian","","CÔNG TY LUẬT TNHH MỘT THÀNH VIÊN NAM SƠN","Thành phố Hồ Chí Minh","Luật"
"8bafa659-12f2-11f0-8a60-0a0027000011","Luật sư tư vấn bất động sản","Tư vấn pháp lý mua bán đất đai. Soạn thảo hợp đồng bất động sản. Giải quyết tranh chấp tài sản. Hỗ trợ đăng ký quyền sở hữu. Theo dõi luật mới.","P802 #8 Tòa nhà Viet Nam Business Center 57-59 Hồ Tùng Mậu, Phường Bến Nghé, Quận 1, Thành phố Hồ Chí Minh","36000000","3 năm","Toàn thời gian","","CÔNG TY LUẬT TNHH MỘT THÀNH VIÊN NAM SƠN","Thành phố Hồ Chí Minh","Luật"
"8bafa7f9-12f2-11f0-8a60-0a0027000011","Chuyên viên pháp lý môi trường","Hỗ trợ pháp lý dự án môi trường. Kiểm tra giấy phép môi trường. Tư vấn quy định bảo vệ môi trường. Giải quyết tranh chấp môi trường. Báo cáo rủi ro.","P802 #8 Tòa nhà Viet Nam Business Center 57-59 Hồ Tùng Mậu, Phường Bến Nghé, Quận 1, Thành phố Hồ Chí Minh","26000000","2 năm","Toàn thời gian","","CÔNG TY LUẬT TNHH MỘT THÀNH VIÊN NAM SƠN","Thành phố Hồ Chí Minh","Luật"
"8bafa904-12f2-11f0-8a60-0a0027000011","Nhân viên hỗ trợ pháp lý tài sản","Hỗ trợ kiểm tra pháp lý tài sản. Chuẩn bị hồ sơ sở hữu. Tư vấn quy định tài sản. Liên hệ cơ quan chức năng. Quản lý tài liệu.","P802 #8 Tòa nhà Viet Nam Business Center 57-59 Hồ Tùng Mậu, Phường Bến Nghé, Quận 1, Thành phố Hồ Chí Minh","17000000","1 năm","Toàn thời gian","","CÔNG TY LUẬT TNHH MỘT THÀNH VIÊN NAM SƠN","Thành phố Hồ Chí Minh","Luật"
"8bafaa03-12f2-11f0-8a60-0a0027000011","Luật sư tư vấn sở hữu trí tuệ","Tư vấn đăng ký bản quyền. Soạn thảo hợp đồng chuyển nhượng. Giải quyết tranh chấp sở hữu trí tuệ. Hỗ trợ bảo vệ sáng chế. Theo dõi luật mới.","P802 #8 Tòa nhà Viet Nam Business Center 57-59 Hồ Tùng Mậu, Phường Bến Nghé, Quận 1, Thành phố Hồ Chí Minh","35000000","3 năm","Toàn thời gian","","CÔNG TY LUẬT TNHH MỘT THÀNH VIÊN NAM SƠN","Thành phố Hồ Chí Minh","Luật"
"8bafab72-12f2-11f0-8a60-0a0027000011","Chuyên viên pháp lý lao động","Hỗ trợ pháp lý quan hệ lao động. Kiểm tra hợp đồng lao động. Tư vấn quy định lao động. Giải quyết tranh chấp lao động. Báo cáo rủi ro.","P802 #8 Tòa nhà Viet Nam Business Center 57-59 Hồ Tùng Mậu, Phường Bến Nghé, Quận 1, Thành phố Hồ Chí Minh","25000000","2 năm","Toàn thời gian","","CÔNG TY LUẬT TNHH MỘT THÀNH VIÊN NAM SƠN","Thành phố Hồ Chí Minh","Luật"
"8bafbcc7-12f2-11f0-8a60-0a0027000011","Nhân viên pháp lý doanh nghiệp nhỏ","Hỗ trợ pháp lý doanh nghiệp nhỏ. Kiểm tra hợp đồng kinh doanh. Tư vấn quy định doanh nghiệp. Chuẩn bị tài liệu pháp lý. Liên hệ cơ quan.","P802 #8 Tòa nhà Viet Nam Business Center 57-59 Hồ Tùng Mậu, Phường Bến Nghé, Quận 1, Thành phố Hồ Chí Minh","16000000","1 năm","Toàn thời gian","","CÔNG TY LUẬT TNHH MỘT THÀNH VIÊN NAM SƠN","Thành phố Hồ Chí Minh","Luật"
"8bafbe66-12f2-11f0-8a60-0a0027000011","Luật sư tư vấn cạnh tranh","Tư vấn pháp lý cạnh tranh. Soạn thảo hồ sơ chống độc quyền. Giải quyết tranh chấp cạnh tranh. Hỗ trợ tuân thủ quy định. Theo dõi luật mới.","P802 #8 Tòa nhà Viet Nam Business Center 57-59 Hồ Tùng Mậu, Phường Bến Nghé, Quận 1, Thành phố Hồ Chí Minh","37000000","3 năm","Toàn thời gian","","CÔNG TY LUẬT TNHH MỘT THÀNH VIÊN NAM SƠN","Thành phố Hồ Chí Minh","Luật"
"8bafbfea-12f2-11f0-8a60-0a0027000011","Chuyên viên pháp lý hợp tác xã","Hỗ trợ pháp lý hợp tác xã. Kiểm tra hợp đồng hợp tác. Tư vấn quy định pháp luật. Giải quyết tranh chấp hợp tác. Báo cáo rủi ro.","P802 #8 Tòa nhà Viet Nam Business Center 57-59 Hồ Tùng Mậu, Phường Bến Nghé, Quận 1, Thành phố Hồ Chí Minh","25000000","2 năm","Toàn thời gian","","CÔNG TY LUẬT TNHH MỘT THÀNH VIÊN NAM SƠN","Thành phố Hồ Chí Minh","Luật"
"8bafc15c-12f2-11f0-8a60-0a0027000011","Nhân viên hỗ trợ pháp lý giáo dục","Hỗ trợ pháp lý trường học. Chuẩn bị hồ sơ pháp lý. Tư vấn quy định giáo dục. Liên hệ cơ quan chức năng. Quản lý tài liệu.","P802 #8 Tòa nhà Viet Nam Business Center 57-59 Hồ Tùng Mậu, Phường Bến Nghé, Quận 1, Thành phố Hồ Chí Minh","16000000","1 năm","Toàn thời gian","","CÔNG TY LUẬT TNHH MỘT THÀNH VIÊN NAM SƠN","Thành phố Hồ Chí Minh","Luật"
"8bafc289-12f2-11f0-8a60-0a0027000011","Luật sư tư vấn đấu thầu","Tư vấn pháp lý đấu thầu. Soạn thảo hồ sơ thầu. Giải quyết tranh chấp thầu. Hỗ trợ đàm phán. Theo dõi quy định.","P802 #8 Tòa nhà Viet Nam Business Center 57-59 Hồ Tùng Mậu, Phường Bến Nghé, Quận 1, Thành phố Hồ Chí Minh","36000000","3 năm","Toàn thời gian","","CÔNG TY LUẬT TNHH MỘT THÀNH VIÊN NAM SƠN","Thành phố Hồ Chí Minh","Luật"
"8bafc3a5-12f2-11f0-8a60-0a0027000011","Chuyên viên pháp lý quốc tế","Hỗ trợ pháp lý hợp đồng quốc tế. Kiểm tra điều khoản quốc tế. Tư vấn quy định thương mại toàn cầu. Giải quyết tranh chấp quốc tế. Báo cáo rủi ro.","P802 #8 Tòa nhà Viet Nam Business Center 57-59 Hồ Tùng Mậu, Phường Bến Nghé, Quận 1, Thành phố Hồ Chí Minh","33000000","3 năm","Toàn thời gian","","CÔNG TY LUẬT TNHH MỘT THÀNH VIÊN NAM SƠN","Thành phố Hồ Chí Minh","Luật"
"8bafc529-12f2-11f0-8a60-0a0027000011","Nhân viên pháp lý bảo hiểm","Hỗ trợ pháp lý hợp đồng bảo hiểm. Kiểm tra điều khoản bảo hiểm. Tư vấn quy định bảo hiểm. Chuẩn bị tài liệu pháp lý. Liên hệ khách hàng.","P802 #8 Tòa nhà Viet Nam Business Center 57-59 Hồ Tùng Mậu, Phường Bến Nghé, Quận 1, Thành phố Hồ Chí Minh","17000000","1 năm","Toàn thời gian","","CÔNG TY LUẬT TNHH MỘT THÀNH VIÊN NAM SƠN","Thành phố Hồ Chí Minh","Luật"
"8bafc662-12f2-11f0-8a60-0a0027000011","Luật sư tư vấn xây dựng","Tư vấn pháp lý dự án xây dựng. Soạn thảo hợp đồng thi công. Giải quyết tranh chấp xây dựng. Hỗ trợ xin giấy phép. Theo dõi luật mới.","P802 #8 Tòa nhà Viet Nam Business Center 57-59 Hồ Tùng Mậu, Phường Bến Nghé, Quận 1, Thành phố Hồ Chí Minh","35000000","3 năm","Toàn thời gian","","CÔNG TY LUẬT TNHH MỘT THÀNH VIÊN NAM SƠN","Thành phố Hồ Chí Minh","Luật"
"8bafc779-12f2-11f0-8a60-0a0027000011","Chuyên viên pháp lý năng lượng","Hỗ trợ pháp lý dự án năng lượng. Kiểm tra hợp đồng cung cấp. Tư vấn quy định năng lượng. Giải quyết tranh chấp năng lượng. Báo cáo rủi ro.","P802 #8 Tòa nhà Viet Nam Business Center 57-59 Hồ Tùng Mậu, Phường Bến Nghé, Quận 1, Thành phố Hồ Chí Minh","26000000","2 năm","Toàn thời gian","","CÔNG TY LUẬT TNHH MỘT THÀNH VIÊN NAM SƠN","Thành phố Hồ Chí Minh","Luật"
"8bafc88d-12f2-11f0-8a60-0a0027000011","Nhân viên hỗ trợ pháp lý y tế","Hỗ trợ pháp lý bệnh viện. Chuẩn bị hồ sơ pháp lý. Tư vấn quy định y tế. Liên hệ cơ quan chức năng. Quản lý tài liệu.","P802 #8 Tòa nhà Viet Nam Business Center 57-59 Hồ Tùng Mậu, Phường Bến Nghé, Quận 1, Thành phố Hồ Chí Minh","16000000","1 năm","Toàn thời gian","","CÔNG TY LUẬT TNHH MỘT THÀNH VIÊN NAM SƠN","Thành phố Hồ Chí Minh","Luật"
"8bafc99c-12f2-11f0-8a60-0a0027000011","Luật sư tư vấn logistics","Tư vấn pháp lý vận tải. Soạn thảo hợp đồng logistics. Giải quyết tranh chấp vận chuyển. Hỗ trợ tuân thủ quy định. Theo dõi luật mới.","P802 #8 Tòa nhà Viet Nam Business Center 57-59 Hồ Tùng Mậu, Phường Bến Nghé, Quận 1, Thành phố Hồ Chí Minh","34000000","3 năm","Toàn thời gian","","CÔNG TY LUẬT TNHH MỘT THÀNH VIÊN NAM SƠN","Thành phố Hồ Chí Minh","Luật"
"8bafcb06-12f2-11f0-8a60-0a0027000011","Chuyên viên pháp lý hàng hải","Hỗ trợ pháp lý vận tải biển. Kiểm tra hợp đồng hàng hải. Tư vấn quy định vận chuyển quốc tế. Giải quyết tranh chấp tàu biển. Báo cáo rủi ro.","P802 #8 Tòa nhà Viet Nam Business Center 57-59 Hồ Tùng Mậu, Phường Bến Nghé, Quận 1, Thành phố Hồ Chí Minh","27000000","2 năm","Toàn thời gian","","CÔNG TY LUẬT TNHH MỘT THÀNH VIÊN NAM SƠN","Thành phố Hồ Chí Minh","Luật"
"8bafcc46-12f2-11f0-8a60-0a0027000011","Nhân viên pháp lý công nghệ thông tin","Hỗ trợ pháp lý dự án CNTT. Kiểm tra hợp đồng phần mềm. Tư vấn quy định bảo mật dữ liệu. Chuẩn bị tài liệu pháp lý. Liên hệ khách hàng.","P802 #8 Tòa nhà Viet Nam Business Center 57-59 Hồ Tùng Mậu, Phường Bến Nghé, Quận 1, Thành phố Hồ Chí Minh","17000000","1 năm","Toàn thời gian","","CÔNG TY LUẬT TNHH MỘT THÀNH VIÊN NAM SƠN","Thành phố Hồ Chí Minh","Luật"
"8c19fd6d-259c-4f9a-8cd1-072e9c247d24","Full-Stack Developer","Cung cấp giải pháp, phát triển phần mềm cho end-user Phát triển các sản phẩm phần mềm theo yêu cầu của khách hàng (offshore) Phát triển nhiều loại hình phần mềm: Windows Application (Java/.NET), Web Application (Java/.NET/PHP), Smartphone Application (iOS/Android)","Saigon Hitech Park, Phường Tây Thạnh, Quận Tân Phú, Thành phố Hồ Chí Minh","14000000","3 năm","Toàn thời gian","","FPT Software","Thành phố Hồ Chí Minh","Cơ khí/Điện - điện tử | IT phần mềm"
"8c29a444-ac4c-4b55-9752-ab610b7c60d1","Chuyên viên Kế hoạch vận chuyển","Xử lý chứng từ xuất nhập khẩu. Phối hợp với các bộ phận để làm thủ tục hải quan.","Số nhà 54 ngõ 120 tổ 31 đường Kim Giang, Phường Đại Kim, Quận Hoàng Mai, Thành phố Hà Nội","13500000","1 năm","Toàn thời gian","","CÔNG TY CỔ PHẦN ĐẦU TƯ VÀ CÔNG NGHỆ OSB","Hà Nội","Kinh doanh | Logistics"
"8c534a3b-b1f5-4b6f-87b1-f92a68bc0113","Nhân viên Xuất nhập khẩu","Lập kế hoạch vận chuyển hàng hóa. Theo dõi chi phí vận tải và tối ưu chi phí.","405/15 Xô Viết Nghệ Tĩnh, Phường 25, Quận Bình Thạnh, Thành phố Hồ Chí Minh","16500000","1 năm","Toàn thời gian","","CÔNG TY CỔ PHẦN DỊCH VỤ GIAO HÀNG NHANH","Thành phố Hồ Chí Minh","Kinh doanh | Logistics | Tài xế"
"8ff62e85-9793-4cdf-bb30-07f646911a52","Chuyên viên Logistics","Xử lý chứng từ xuất nhập khẩu. Phối hợp với các bộ phận để làm thủ tục hải quan.","Số nhà 54 ngõ 120 tổ 31 đường Kim Giang, Phường Đại Kim, Quận Hoàng Mai, Thành phố Hà Nội","13500000","1 năm","Toàn thời gian","","CÔNG TY CỔ PHẦN ĐẦU TƯ VÀ CÔNG NGHỆ OSB","Hà Nội","Kinh doanh | Logistics"
"919d2d71-3c35-4ccb-aeb9-99c51966ba8a","Nhân Viên Giám Sát Dịch Vụ","Giám sát quy trình check - in. Giám sát quy trình phục vụ khách. Giám sát thái độ, tác phong của nhân viên. Giám sát các tiêu chuẩn (bài trí, thực đơn, đồ uống và các dịch vụ khác theo hợp đồng). Giám sát chất lượng hàng hoá. Giám sát đối chiếu số liệu sản lượng khách. Lập báo cáo. Xử lý các tình huống phát sinh.  Thời gian làm việc: Thứ 2 - Thứ 6 (từ 08:00 đến 17:00)","Khách sạn Sheraton K5 Nghi Tàm số 11 Xuân Diệu, Phường Quảng An, Quận Tây Hồ, Thành phố Hà Nội","11000000","2 năm","Toàn thời gian","","CÔNG TY TNHH MẶT TRỜI PHÚ QUỐC - VĂN PHÒNG ĐẠI DIỆN KHÁCH SẠN JW MARRIOTT PHU QUOC TẠI TP. HÀ NỘI","Hà Nội","Kinh doanh | Nhà hàng/Khách sạn"
"927d1e9b-b920-4915-a14f-1a1759883759","Chuyên viên CRM","Triển khai hệ thống CRM cho doanh nghiệp. Làm việc với Salesforce. Hỗ trợ khách hàng cấu hình hệ thống. Kiểm tra và tối ưu quy trình. Đảm bảo chất lượng triển khai.","Lô T412-413 Tầng 4 Tòa nhà Artemis số 03 Lê Trọng Tấn, Phường Khương Mai, Quận Thanh Xuân, Thành phố Hà Nội","21000000","1 năm","Bán thời gian","","CÔNG TY TNHH DCOM EXPRESS","Hà Nội","IT phần mềm"
"955814de-0c17-43b0-a00d-181d28769960","Điều phối viên kho","Kiểm kê, sắp xếp hàng hóa trong kho. Thực hiện các thủ tục nhập/xuất kho.","405/15 Xô Viết Nghệ Tĩnh, Phường 25, Quận Bình Thạnh, Thành phố Hồ Chí Minh","15000000","Không yêu cầu","Toàn thời gian","","CÔNG TY CỔ PHẦN DỊCH VỤ GIAO HÀNG NHANH","Thành phố Hồ Chí Minh","Kinh doanh | Logistics | Tài xế"
