"postId","title","description","location","salary","experience","typeOfWork","companyId","companyName","cityName","industryNames"
"2d995d81-13b0-11f0-8a60-0a0027000011","Chuyên viên E-learning","Phát triển nội dung học trực tuyến. Quản lý nền tảng LMS. Hỗ trợ học viên sử dụng hệ thống. Đánh giá hiệu quả khóa học. Cập nhật công nghệ giáo dục.","60 Nguyễn Văn Thủ, Phường Đa Kao, Quận 1, Thành phố Hồ Chí Minh","22000000","2 năm","Toàn thời gian","","CÔNG TY CỔ PHẦN CÔNG NGHỆ GIÁO DỤC MAAS","Thành phố Hồ Chí Minh","Giáo dục/Đào tạo"
"2d995ee4-13b0-11f0-8a60-0a0027000011","Giáo viên Tin học THCS","Dạy Tin học cho học sinh THCS. Hướng dẫn lập trình cơ bản. Chuẩn bị tài liệu thực hành. Đánh giá kỹ năng công nghệ. Tổ chức cuộc thi Tin học.","65 Phố Yên Lãng, Phường Trung Liệt, Quận Đống Đa, Thành phố Hà Nội","14000000","1 năm","Toàn thời gian","","CÔNG TY CỔ PHẦN EDUVATOR","Hà Nội","Giáo dục/Đào tạo"
"2d9961e4-13b0-11f0-8a60-0a0027000011","Nhân viên Tuyển sinh Trường học","Tư vấn tuyển sinh cho phụ huynh. Quản lý hồ sơ học sinh. Tổ chức ngày hội tư vấn. Theo dõi chỉ tiêu tuyển sinh. Báo cáo kết quả hàng tháng.","65 Phố Yên Lãng, Phường Trung Liệt, Quận Đống Đa, Thành phố Hà Nội","15000000","1 năm","Toàn thời gian","","CÔNG TY CỔ PHẦN EDUVATOR","Hà Nội","Giáo dục/Đào tạo"
"2d99634c-13b0-11f0-8a60-0a0027000011","Giảng viên Kinh tế Đại học","Giảng dạy các môn Kinh tế cho sinh viên. Hướng dẫn đồ án tốt nghiệp. Nghiên cứu khoa học kinh tế. Chấm bài thi định kỳ. Tham gia hội thảo chuyên ngành.","65 Phố Yên Lãng, Phường Trung Liệt, Quận Đống Đa, Thành phố Hà Nội","28000000","3 năm","Toàn thời gian","","CÔNG TY CỔ PHẦN EDUVATOR","Hà Nội","Giáo dục/Đào tạo"
"2d9964cd-13b0-11f0-8a60-0a0027000011","Giáo viên Hóa học THPT","Dạy Hóa học cho học sinh THPT. Tổ chức thí nghiệm thực hành. Hướng dẫn ôn thi đại học. Đánh giá bài tập và bài kiểm tra. Tham gia bồi dưỡng chuyên môn.","65 Phố Yên Lãng, Phường Trung Liệt, Quận Đống Đa, Thành phố Hà Nội","16000000","2 năm","Toàn thời gian","","CÔNG TY CỔ PHẦN EDUVATOR","Hà Nội","Giáo dục/Đào tạo"
"2d9965f8-13b0-11f0-8a60-0a0027000011","Chuyên viên Quản lý Học vụ","Quản lý lịch học và thi cử. Xử lý hồ sơ học sinh/sinh viên. Hỗ trợ giáo viên và học viên. Kiểm tra dữ liệu học vụ. Báo cáo định kỳ cho ban giám hiệu.","65 Phố Yên Lãng, Phường Trung Liệt, Quận Đống Đa, Thành phố Hà Nội","17000000","2 năm","Toàn thời gian","","CÔNG TY CỔ PHẦN EDUVATOR","Hà Nội","Giáo dục/Đào tạo"
"2d996966-13b0-11f0-8a60-0a0027000011","Giáo viên Mẫu giáo","Dạy học và chăm sóc trẻ mẫu giáo. Tổ chức hoạt động vui chơi. Hướng dẫn kỹ năng cơ bản. Theo dõi sức khỏe trẻ. Giao tiếp với phụ huynh.","65 Phố Yên Lãng, Phường Trung Liệt, Quận Đống Đa, Thành phố Hà Nội","12000000","1 năm","Toàn thời gian","","CÔNG TY CỔ PHẦN EDUVATOR","Hà Nội","Giáo dục/Đào tạo"
"2d996a96-13b0-11f0-8a60-0a0027000011","Chuyên viên Hỗ trợ Sinh viên","Hỗ trợ sinh viên trong học tập và đời sống. Tư vấn định hướng nghề nghiệp. Tổ chức hoạt động ngoại khóa. Quản lý thông tin sinh viên. Giải đáp thắc mắc.","65 Phố Yên Lãng, Phường Trung Liệt, Quận Đống Đa, Thành phố Hà Nội","16000000","1 năm","Toàn thời gian","","CÔNG TY CỔ PHẦN EDUVATOR","Hà Nội","Giáo dục/Đào tạo"
"2d996bf2-13b0-11f0-8a60-0a0027000011","Giáo viên Lịch sử THCS","Dạy Lịch sử cho học sinh THCS. Thiết kế bài giảng hấp dẫn. Hướng dẫn học sinh tìm hiểu lịch sử. Đánh giá bài kiểm tra. Tổ chức hoạt động ngoại khóa.","65 Phố Yên Lãng, Phường Trung Liệt, Quận Đống Đa, Thành phố Hà Nội","14000000","2 năm","Toàn thời gian","","CÔNG TY CỔ PHẦN EDUVATOR","Hà Nội","Giáo dục/Đào tạo"
"2d996d17-13b0-11f0-8a60-0a0027000011","Nhân viên Đào tạo Kỹ thuật","Đào tạo kỹ thuật cho nhân viên mới. Xây dựng tài liệu hướng dẫn. Hỗ trợ thực hành tại chỗ. Đánh giá kỹ năng sau đào tạo. Cập nhật nội dung kỹ thuật.","65 Phố Yên Lãng, Phường Trung Liệt, Quận Đống Đa, Thành phố Hà Nội","19000000","2 năm","Toàn thời gian","","CÔNG TY CỔ PHẦN EDUVATOR","Hà Nội","Giáo dục/Đào tạo"
"2d996e39-13b0-11f0-8a60-0a0027000011","Giáo viên Âm nhạc Tiểu học","Dạy Âm nhạc cho học sinh tiểu học. Hướng dẫn hát và chơi nhạc cụ. Tổ chức biểu diễn nghệ thuật. Chuẩn bị giáo án sáng tạo. Đánh giá năng khiếu học sinh.","65 Phố Yên Lãng, Phường Trung Liệt, Quận Đống Đa, Thành phố Hà Nội","13000000","1 năm","Toàn thời gian","","CÔNG TY CỔ PHẦN EDUVATOR","Hà Nội","Giáo dục/Đào tạo"
"2d996ffb-13b0-11f0-8a60-0a0027000011","Chuyên viên Quản lý Chất lượng Giáo dục","Kiểm tra chất lượng giảng dạy. Thu thập dữ liệu đánh giá giáo viên. Phân tích hiệu quả chương trình học. Đề xuất cải tiến chất lượng. Báo cáo cho ban lãnh đạo.","65 Phố Yên Lãng, Phường Trung Liệt, Quận Đống Đa, Thành phố Hà Nội","21000000","3 năm","Toàn thời gian","","CÔNG TY CỔ PHẦN EDUVATOR","Hà Nội","Giáo dục/Đào tạo"
"2d99712d-13b0-11f0-8a60-0a0027000011","Giáo viên Công dân THCS","Dạy Giáo dục Công dân cho học sinh THCS. Hướng dẫn đạo đức và pháp luật cơ bản. Thiết kế bài giảng thực tiễn. Đánh giá nhận thức học sinh. Tổ chức thảo luận nhóm.","65 Phố Yên Lãng, Phường Trung Liệt, Quận Đống Đa, Thành phố Hà Nội","14000000","1 năm","Toàn thời gian","","CÔNG TY CỔ PHẦN EDUVATOR","Hà Nội","Giáo dục/Đào tạo"
"2d997273-13b0-11f0-8a60-0a0027000011","Nhân viên Tuyển dụng Giáo viên","Tuyển dụng giáo viên cho trung tâm. Phỏng vấn và đánh giá ứng viên. Quản lý hồ sơ tuyển dụng. Phối hợp với ban giám đốc. Theo dõi tiến độ tuyển dụng.","Số 2 hẻm 1194/141/25 đường Láng, Phường Láng Thượng, Phường Láng Thượng, Quận Đống Đa, Thành phố Hà Nội","17000000","2 năm","Toàn thời gian","","Công Ty Cổ Phần Tập Đoàn Babylons","Hà Nội","Giáo dục/Đào tạo"
"2d9973e5-13b0-11f0-8a60-0a0027000011","Giáo viên Tiếng Pháp","Dạy Tiếng Pháp cho học viên mọi cấp độ. Hướng dẫn ngữ pháp và giao tiếp. Chuẩn bị bài giảng phong phú. Đánh giá trình độ học viên. Tổ chức hoạt động văn hóa Pháp.","Số 2 hẻm 1194/141/25 đường Láng, Phường Láng Thượng, Phường Láng Thượng, Quận Đống Đa, Thành phố Hà Nội","20000000","2 năm","Toàn thời gian","","Công Ty Cổ Phần Tập Đoàn Babylons","Hà Nội","Giáo dục/Đào tạo"
"2d9978de-13b0-11f0-8a60-0a0027000011","Chuyên viên Phát triển Kỹ năng Mềm","Thiết kế chương trình kỹ năng mềm. Tổ chức lớp học tương tác. Hướng dẫn học viên ứng dụng thực tế. Đánh giá hiệu quả đào tạo. Cập nhật xu hướng kỹ năng.","Số 2 hẻm 1194/141/25 đường Láng, Phường Láng Thượng, Phường Láng Thượng, Quận Đống Đa, Thành phố Hà Nội","19000000","2 năm","Toàn thời gian","","Công Ty Cổ Phần Tập Đoàn Babylons","Hà Nội","Giáo dục/Đào tạo"
"2d997b77-13b0-11f0-8a60-0a0027000011","Giáo viên Công nghệ THPT","Dạy Công nghệ cho học sinh THPT. Hướng dẫn thực hành kỹ thuật. Chuẩn bị bài giảng thực tiễn. Đánh giá kỹ năng học sinh. Tham gia sinh hoạt chuyên môn.","Số 2 hẻm 1194/141/25 đường Láng, Phường Láng Thượng, Phường Láng Thượng, Quận Đống Đa, Thành phố Hà Nội","16000000","2 năm","Toàn thời gian","","Công Ty Cổ Phần Tập Đoàn Babylons","Hà Nội","Giáo dục/Đào tạo"
"2d997caa-13b0-11f0-8a60-0a0027000011","Nhân viên Hỗ trợ Học trực tuyến","Hỗ trợ học viên sử dụng nền tảng học online. Giải đáp thắc mắc kỹ thuật. Quản lý tài khoản học viên. Phối hợp với đội ngũ giảng viên. Báo cáo sự cố hệ thống.","Số 2 hẻm 1194/141/25 đường Láng, Phường Láng Thượng, Phường Láng Thượng, Quận Đống Đa, Thành phố Hà Nội","15000000","1 năm","Toàn thời gian","","Công Ty Cổ Phần Tập Đoàn Babylons","Hà Nội","Giáo dục/Đào tạo"
"2d997dba-13b0-11f0-8a60-0a0027000011","Giáo viên Luyện thi IELTS","Dạy kỹ năng làm bài thi IELTS. Hướng dẫn chiến lược đạt điểm cao. Chuẩn bị tài liệu ôn luyện. Đánh giá tiến độ học viên. Tổ chức thi thử định kỳ.","19-21-23 Mạc Đĩnh Chi, Phường Đa Kao, Quận 1, Thành phố Hồ Chí Minh","22000000","2 năm","Toàn thời gian","","CÔNG TY TNHH  ILA VIỆT NAM","Thành phố Hồ Chí Minh","Giáo dục/Đào tạo"
"2d997f84-13b0-11f0-8a60-0a0027000011","Chuyên viên Quản lý Dự án Giáo dục","Quản lý các dự án giáo dục. Lập kế hoạch và phân bổ nguồn lực. Theo dõi tiến độ dự án. Đánh giá kết quả thực hiện. Báo cáo cho ban lãnh đạo.","19-21-23 Mạc Đĩnh Chi, Phường Đa Kao, Quận 1, Thành phố Hồ Chí Minh","23000000","3 năm","Toàn thời gian","","CÔNG TY TNHH  ILA VIỆT NAM","Thành phố Hồ Chí Minh","Giáo dục/Đào tạo"
"2d9980b6-13b0-11f0-8a60-0a0027000011","Giáo viên Luyện thi Đại học Môn Toán","Dạy Toán ôn thi đại học. Hướng dẫn kỹ thuật giải đề nhanh. Chuẩn bị tài liệu ôn luyện. Đánh giá năng lực học sinh. Tổ chức thi thử thường xuyên.","4 Hoàng Cầu, Phường Ô Chợ Dừa, Quận Đống Đa, Thành phố Hà Nội","20000000","2 năm","Toàn thời gian","","CÔNG TY TNHH GIÁO DỤC IZONE","Hà Nội","Giáo dục/Đào tạo | Kinh doanh"
"2d9982b3-13b0-11f0-8a60-0a0027000011","Nhân viên Phát triển Nội dung Đào tạo","Xây dựng nội dung đào tạo chuyên sâu. Nghiên cứu tài liệu mới. Phối hợp với chuyên gia. Kiểm tra chất lượng nội dung. Cập nhật xu hướng đào tạo.","4 Hoàng Cầu, Phường Ô Chợ Dừa, Quận Đống Đa, Thành phố Hà Nội","18000000","2 năm","Toàn thời gian","","CÔNG TY TNHH GIÁO DỤC IZONE","Hà Nội","Giáo dục/Đào tạo | Kinh doanh"
"2d9983f7-13b0-11f0-8a60-0a0027000011","Giáo viên Dạy Nấu ăn","Dạy kỹ năng nấu ăn cho học viên. Hướng dẫn công thức món ăn. Chuẩn bị nguyên liệu thực hành. Đánh giá sản phẩm học viên. Tổ chức thi nấu ăn.","4 Hoàng Cầu, Phường Ô Chợ Dừa, Quận Đống Đa, Thành phố Hà Nội","17000000","2 năm","Toàn thời gian","","CÔNG TY TNHH GIÁO DỤC IZONE","Hà Nội","Giáo dục/Đào tạo | Kinh doanh"
"2d99850e-13b0-11f0-8a60-0a0027000011","Chuyên viên Tư vấn Tâm lý Học đường","Tư vấn tâm lý cho học sinh. Hỗ trợ giải quyết vấn đề cá nhân. Tổ chức buổi chia sẻ tâm lý. Phối hợp với giáo viên và phụ huynh. Theo dõi sức khỏe tinh thần.","4 Hoàng Cầu, Phường Ô Chợ Dừa, Quận Đống Đa, Thành phố Hà Nội","19000000","2 năm","Toàn thời gian","","CÔNG TY TNHH GIÁO DỤC IZONE","Hà Nội","Giáo dục/Đào tạo | Kinh doanh"
"2d998628-13b0-11f0-8a60-0a0027000011","Giáo viên Dạy Lái xe","Dạy kỹ năng lái xe cho học viên. Hướng dẫn luật giao thông. Chuẩn bị bài thực hành. Đánh giá khả năng lái xe. Hỗ trợ học viên thi sát hạch.","4 Hoàng Cầu, Phường Ô Chợ Dừa, Quận Đống Đa, Thành phố Hà Nội","18000000","2 năm","Toàn thời gian","","CÔNG TY TNHH GIÁO DỤC IZONE","Hà Nội","Giáo dục/Đào tạo | Kinh doanh"
"2d99873b-13b0-11f0-8a60-0a0027000011","Nhân viên Điều phối Chương trình Giáo dục","Điều phối các chương trình giáo dục. Liên hệ với đối tác và giáo viên. Quản lý lịch trình sự kiện. Hỗ trợ tổ chức hội thảo. Báo cáo tiến độ công việc.","4 Hoàng Cầu, Phường Ô Chợ Dừa, Quận Đống Đa, Thành phố Hà Nội","17000000","2 năm","Toàn thời gian","","CÔNG TY TNHH GIÁO DỤC IZONE","Hà Nội","Giáo dục/Đào tạo | Kinh doanh"
"2ef5c1c7-6562-4775-bd16-68959a0dbde5","Cố Vấn Dịch Vụ Sửa Chữa Ô Tô","Nhận thông tin về xe từ khách hàng Tư vấn cho khách hàng về việc bảo dưỡng, sửa chữa, lập báo giá, trao đổi, thuyết phục khách hàng. Theo dõi tiến độ, kết quả sửa chữa từ kỹ thuật viên để phản hồi với khách hàng. Bàn giao xe đã hoàn thiện cho khách. Chăm sóc khách hàng.","Km 6 đường Bắc Thăng Long – Nội Bài, Xã Nam Hồng, Huyện Đông Anh, Thành phố Hà Nội","11000000","1 năm","Toàn thời gian","","CÔNG TY CỔ PHẦN Ô TÔ KCV THĂNG LONG","Hà Nội","Công nghệ ô tô"
"2efa0cfd-e8b4-4b7e-bbe0-9b39d000eb13","Thực tập sinh Spring","Hỗ trợ phát triển ứng dụng với Spring. Làm quen với Spring Boot. Xử lý dữ liệu cơ bản. Học hỏi từ lập trình viên kinh nghiệm. Tham gia dự án thực tế.","Tầng 6 Toà nhà Đồng Lợi số 2+4 ngõ 1160 Đường Láng, Phường Láng Thượng, Quận Đống Đa, Thành phố Hà Nội","4600000","6 tháng","Thực tập sinh","","CÔNG TY CỔ PHẦN INFINITY TECHNOLOGIES GLOBAL","Hà Nội","IT phần mềm"
"2f3e7b1c-5d9a-4f0d-8a6a-1b7c4d2e9f58","Chuyên viên triển khai phần mềm","Triển khai phần mềm cho khách hàng. Hỗ trợ cài đặt và cấu hình. Kiểm tra tính năng phần mềm. Hướng dẫn người dùng. Đảm bảo triển khai thành công.","Số 237 Ngô Thì Nhậm, Phường An Khánh, Quận Ninh Kiều, Thành phố Cần Thơ","21000000","1 năm","Bán thời gian","","CÔNG TY TNHH PHẦN MỀM BIWOCO","Cần Thơ","IT phần cứng | IT phần mềm"
"301a5453-0103-4e5c-afe1-3c0cf81cc853","Chuyên viên Kế hoạch vận chuyển","Xử lý chứng từ xuất nhập khẩu. Phối hợp với các bộ phận để làm thủ tục hải quan.","Tòa nhà GIC 156 Trần Quang Khải, Phường Tân Định, Quận 1, Thành phố Hồ Chí Minh","13500000","Không yêu cầu","Toàn thời gian","","CÔNG TY TNHH MỘT THÀNH VIÊN XUẤT NHẬP KHẨU THỦY SẢN NGHI SƠN","Thành phố Hồ Chí Minh","Kinh doanh | Logistics"
"307df69c-f62f-419a-9575-362be96c8812","Nhân viên Xuất nhập khẩu","Lập kế hoạch vận chuyển hàng hóa. Theo dõi chi phí vận tải và tối ưu chi phí.","Số nhà 54 ngõ 120 tổ 31 đường Kim Giang, Phường Đại Kim, Quận Hoàng Mai, Thành phố Hà Nội","16500000","1 năm","Toàn thời gian","","CÔNG TY CỔ PHẦN ĐẦU TƯ VÀ CÔNG NGHỆ OSB","Hà Nội","Kinh doanh | Logistics"
"3102db0a-7fba-4413-b002-d3bf22778f7a","Nhân Viên Kinh Doanh","Lập kế hoạch kinh doanh, tiếp cận, tìm kiếm khách hàng tiềm năng  Ký kết hợp đồng  Phát triển thị trường/sản phẩm  Quan hệ khách hàng","Lô C2, khu công nghiệp Gián Khẩu, Xã Gia Trấn, Huyện Gia Viễn, Tỉnh Ninh Bình","13000000","2 năm","Toàn thời gian","","CÔNG TY TNHH THÁI BÌNH DƯƠNG","Ninh Bình","Kinh doanh | Marketing/Truyền thông | Thiết kế/In ấn"
"32d937f6-dfd0-48f5-99a5-9d704c58ace7","Account Manager (Event, Truyền Thông, Truyền Hình)","Lập kế hoạch, xây dựng Proposal cho các chương trình truyền hình, dịch vụ theo yêu cầu của khách hàng, và tìm kiếm tài trợ cho các chương trình, các dịch vụ. Tìm kiếm khách hàng liên quan đến các dịch vụ media, truyền thông, tổ chức sự kiện,... Nhận brief thông tin từ khách hàng, lên kế hoạch, Proposal, bảng chào giá chi tiết để chào khách hàng. Hỗ trợ team kinh doanh chuẩn bị tài liệu, hợp đồng và tạo mối quan hệ tốt với Client. Quản lý, điều phối, theo dõi tiến độ dự án để đáp ứng được yêu cầu của Client. Gặp gỡ khách hàng để trao đổi về nhu cầu quảng cáo. Làm việc với các bộ phận Creative, Project, team sản xuất nội bộ... để đưa ra từng chiến dịch phù hợp với yêu cầu và ngân sách của từng khách hàng.","6D Trần Quang Diệu, Phường 12, Quận 3, Thành phố Hồ Chí Minh","25000000","3 năm","Toàn thời gian","","CÔNG TY TNHH TRUYỀN THÔNG BEE","Thành phố Hồ Chí Minh","Marketing/Truyền thông"
"350cf179-f9d6-454a-b73e-499b0e040d6a","Kỹ sư vi mạch","Thiết kế và phát triển vi mạch. Làm việc với VHDL hoặc Verilog. Xây dựng mô hình phần cứng. Tối ưu hiệu suất vi mạch. Hỗ trợ kiểm thử sản phẩm.","Số 120 Đường Nguyễn Hoàng Tôn, Phường Xuân La, Quận Tây Hồ, Thành phố Hà Nội","35000000","1 năm","Toàn thời gian","","CÔNG TY CỔ PHẦN CÔNG NGHỆ EUP","Hà Nội","IT phần cứng | IT phần mềm"
"35d43ab6-eea2-4f32-bdeb-33b8323884c5","Nhân viên Vận hành Logistics","Theo dõi đơn hàng, cập nhật tiến độ giao hàng. Làm việc với đối tác vận chuyển. Báo cáo tình trạng giao hàng hàng ngày.","S26-28 Đường số 1 KDC Him Lam, Phường Tân Hưng, Quận 7, Thành phố Hồ Chí Minh","12000000","1 năm","Toàn thời gian","","CÔNG TY TNHH DỊCH VỤ TIẾP VẬN TOÀN CẦU","Thành phố Hồ Chí Minh","Kinh doanh | Logistics"
"3663efcd-51b6-42ff-978f-2cb912c2f769","Nhân viên kiểm thử tự động","Kiểm thử phần mềm với công cụ tự động. Xây dựng script với Selenium. Báo cáo lỗi và theo dõi tiến độ. Hỗ trợ đội phát triển. Đảm bảo chất lượng sản phẩm.","140-142 Đường số 2 Vạn Phúc 1, Phường Hiệp Bình Phước, Thành phố Thủ Đức, Thành phố Hồ Chí Minh","19000000","1 năm","Bán thời gian","","CÔNG TY TRÁCH NHIỆM HỮU HẠN CÔNG NGHỆ VIHAT","Thành phố Hồ Chí Minh","IT phần cứng | IT phần mềm"
"37f48c09-51e1-4049-9783-be4262619bf3","Nhân viên chứng từ","Kiểm kê, sắp xếp hàng hóa trong kho. Thực hiện các thủ tục nhập/xuất kho.","405/15 Xô Viết Nghệ Tĩnh, Phường 25, Quận Bình Thạnh, Thành phố Hồ Chí Minh","15000000","1 năm","Toàn thời gian","","CÔNG TY CỔ PHẦN DỊCH VỤ GIAO HÀNG NHANH","Thành phố Hồ Chí Minh","Kinh doanh | Logistics | Tài xế"
"38b6a344-12e7-11f0-8a60-0a0027000011","Chuyên viên bảo mật viễn thông","Đảm bảo an toàn hệ thống mạng. Phát hiện và xử lý lỗ hổng. Xây dựng chính sách bảo mật. Đào tạo nhân sự về an ninh. Giám sát rủi ro.","Elcom Phố Duy Tân, Phường Dịch Vọng Hậu, Quận Cầu Giấy, Thành phố Hà Nội","32000000","3 năm","Toàn thời gian","","CÔNG TY CỔ PHẦN CÔNG NGHỆ - VIỄN THÔNG ELCOM","Hà Nội","Hệ thống nhúng và IOT | IT phần cứng | Viễn thông"
"38b8b1ed-12e7-11f0-8a60-0a0027000011","Kỹ thuật viên cáp quang","Lắp đặt và sửa chữa cáp quang. Kiểm tra chất lượng tín hiệu. Hỗ trợ khách hàng tại chỗ. Báo cáo tiến độ công việc. Tuân thủ an toàn lao động.","Elcom Phố Duy Tân, Phường Dịch Vọng Hậu, Quận Cầu Giấy, Thành phố Hà Nội","20000000","1 năm","Toàn thời gian","","CÔNG TY CỔ PHẦN CÔNG NGHỆ - VIỄN THÔNG ELCOM","Hà Nội","Hệ thống nhúng và IOT | IT phần cứng | Viễn thông"
"38b8b57a-12e7-11f0-8a60-0a0027000011","Nhân viên vận hành NOC","Giám sát hệ thống mạng 24/7. Xử lý sự cố tín hiệu. Cập nhật trạng thái mạng. Phối hợp với đội kỹ thuật. Báo cáo định kỳ.","Elcom Phố Duy Tân, Phường Dịch Vọng Hậu, Quận Cầu Giấy, Thành phố Hà Nội","18000000","6 tháng","Từ xa","","CÔNG TY CỔ PHẦN CÔNG NGHỆ - VIỄN THÔNG ELCOM","Hà Nội","Hệ thống nhúng và IOT | IT phần cứng | Viễn thông"
"38b8b7c2-12e7-11f0-8a60-0a0027000011","Thực tập sinh phân tích dữ liệu viễn thông","Thu thập dữ liệu mạng. Hỗ trợ xây dựng báo cáo. Học cách phân tích hiệu suất. Tham gia dự án nhóm. Sử dụng Excel và công cụ BI.","Elcom Phố Duy Tân, Phường Dịch Vọng Hậu, Quận Cầu Giấy, Thành phố Hà Nội","5000000","Không yêu cầu","Thực tập sinh","","CÔNG TY CỔ PHẦN CÔNG NGHỆ - VIỄN THÔNG ELCOM","Hà Nội","Hệ thống nhúng và IOT | IT phần cứng | Viễn thông"
"38b8ba6f-12e7-11f0-8a60-0a0027000011","Chuyên viên thiết kế mạng không dây","Thiết kế hạ tầng mạng không dây. Tối ưu hóa vùng phủ sóng. Lập kế hoạch triển khai. Hỗ trợ kiểm thử. Đảm bảo hiệu suất mạng.","Elcom Phố Duy Tân, Phường Dịch Vọng Hậu, Quận Cầu Giấy, Thành phố Hà Nội","30000000","2 năm","Toàn thời gian","","CÔNG TY CỔ PHẦN CÔNG NGHỆ - VIỄN THÔNG ELCOM","Hà Nội","Hệ thống nhúng và IOT | IT phần cứng | Viễn thông"
"38b8bbf0-12e7-11f0-8a60-0a0027000011","Kỹ thuật viên bảo trì trạm BTS","Bảo trì trạm BTS định kỳ. Kiểm tra thiết bị phần cứng. Xử lý sự cố tại chỗ. Báo cáo tình trạng trạm. Đảm bảo an toàn lao động.","Elcom Phố Duy Tân, Phường Dịch Vọng Hậu, Quận Cầu Giấy, Thành phố Hà Nội","22000000","1 năm","Toàn thời gian","","CÔNG TY CỔ PHẦN CÔNG NGHỆ - VIỄN THÔNG ELCOM","Hà Nội","Hệ thống nhúng và IOT | IT phần cứng | Viễn thông"
"38b8bd13-12e7-11f0-8a60-0a0027000011","Nhân viên hỗ trợ khách hàng viễn thông","Tư vấn dịch vụ mạng cho khách hàng. Xử lý khiếu nại kỹ thuật. Hỗ trợ qua điện thoại. Ghi nhận phản hồi. Đảm bảo hài lòng khách hàng.","Elcom Phố Duy Tân, Phường Dịch Vọng Hậu, Quận Cầu Giấy, Thành phố Hà Nội","15000000","6 tháng","Bán thời gian","","CÔNG TY CỔ PHẦN CÔNG NGHỆ - VIỄN THÔNG ELCOM","Hà Nội","Hệ thống nhúng và IOT | IT phần cứng | Viễn thông"
"38b8befc-12e7-11f0-8a60-0a0027000011","Chuyên viên tối ưu hóa mạng LTE","Tối ưu hóa hiệu suất mạng LTE. Phân tích dữ liệu tín hiệu. Đề xuất cải tiến QoS. Hỗ trợ kiểm thử. Báo cáo kết quả tối ưu.","Elcom Phố Duy Tân, Phường Dịch Vọng Hậu, Quận Cầu Giấy, Thành phố Hà Nội","35000000","3 năm","Toàn thời gian","","CÔNG TY CỔ PHẦN CÔNG NGHỆ - VIỄN THÔNG ELCOM","Hà Nội","Hệ thống nhúng và IOT | IT phần cứng | Viễn thông"
"38b8c0ab-12e7-11f0-8a60-0a0027000011","Thực tập sinh kỹ thuật viễn thông","Hỗ trợ lắp đặt thiết bị mạng. Kiểm tra tín hiệu cơ bản. Học cách bảo trì hệ thống. Tham gia dự án thực tế. Ghi chép tiến độ.","Elcom Phố Duy Tân, Phường Dịch Vọng Hậu, Quận Cầu Giấy, Thành phố Hà Nội","4000000","Không yêu cầu","Thực tập sinh","","CÔNG TY CỔ PHẦN CÔNG NGHỆ - VIỄN THÔNG ELCOM","Hà Nội","Hệ thống nhúng và IOT | IT phần cứng | Viễn thông"
"38b8c1f7-12e7-11f0-8a60-0a0027000011","Kỹ sư phát triển IoT viễn thông","Phát triển giải pháp IoT cho mạng. Tích hợp cảm biến và thiết bị. Kiểm thử kết nối. Hỗ trợ triển khai thực tế. Tối ưu hiệu suất.","Elcom Phố Duy Tân, Phường Dịch Vọng Hậu, Quận Cầu Giấy, Thành phố Hà Nội","30000000","2 năm","Toàn thời gian","","CÔNG TY CỔ PHẦN CÔNG NGHỆ - VIỄN THÔNG ELCOM","Hà Nội","Hệ thống nhúng và IOT | IT phần cứng | Viễn thông"
"38b8c3c2-12e7-11f0-8a60-0a0027000011","Chuyên viên giám sát mạng từ xa","Giám sát hệ thống qua công cụ online. Xử lý sự cố qua VPN. Cập nhật trạng thái mạng. Hỗ trợ đội kỹ thuật. Báo cáo hàng ngày.","Elcom Phố Duy Tân, Phường Dịch Vọng Hậu, Quận Cầu Giấy, Thành phố Hà Nội","25000000","1 năm","Từ xa","","CÔNG TY CỔ PHẦN CÔNG NGHỆ - VIỄN THÔNG ELCOM","Hà Nội","Hệ thống nhúng và IOT | IT phần cứng | Viễn thông"
"38b8c4c8-12e7-11f0-8a60-0a0027000011","Kỹ thuật viên lắp đặt mạng LAN","Lắp đặt hệ thống mạng LAN. Kiểm tra kết nối nội bộ. Hỗ trợ cấu hình cơ bản. Báo cáo tiến độ. Đảm bảo chất lượng.","Elcom Phố Duy Tân, Phường Dịch Vọng Hậu, Quận Cầu Giấy, Thành phố Hà Nội","19000000","1 năm","Toàn thời gian","","CÔNG TY CỔ PHẦN CÔNG NGHỆ - VIỄN THÔNG ELCOM","Hà Nội","Hệ thống nhúng và IOT | IT phần cứng | Viễn thông"
